{
  "inputs_hash": "a7b3c9d8e2f4a6b1c3d5e7f9a1b2c3d4e5f6a7b8c9d0e1f2a3b4c5d6e7f8a9b0",
  "purpose": "analytics",
  "audience": "internal",
  "retention": "P1Y",
  "revocation": {
    "path": "/api/v1/consent/revoke",
    "effect": "immediate_deletion",
    "grace_period_hours": 0
  },
  "jurisdiction": "caribbean",
  "sealed_by": "compliance-officer@codexdominion.app",
  "artifact_id": "7f3c89d2-4a1b-4e6c-9d7f-2a3b4c5d6e7f",
  "user_id": "user_caribbean_001",
  "consent_type": "explicit",
  "granted": true,
  "granted_at": "2025-12-03T10:30:00Z",
  "expires_at": "2026-12-03T10:30:00Z",
  "data_categories": ["usage_metrics", "preferences", "device"],
  "processing_purposes": [
    "improve_service",
    "personalized_recommendations",
    "performance_monitoring"
  ],
  "cross_border_transfer": false,
  "retention_period_days": 365,
  "automated_decision_making": false,
  "profiling": false,
  "third_party_sharing": false,
  "legal_basis": "consent",
  "dpia_required": false,
  "encryption_at_rest": true,
  "encryption_in_transit": true,
  "pseudonymization": false,
  "anonymization": false,
  "contact_dpo": "dpo@codexdominion.app",
  "version": "1.0.0",
  "metadata": {
    "ip_address": "192.168.1.100",
    "user_agent": "Mozilla/5.0 (Windows NT 10.0; Win64; x64) AppleWebKit/537.36",
    "consent_method": "checkbox",
    "language": "en-US"
  }
}
